{
  "$schema": "https://json-schema.org/draft/2020-12/schema",
  "title": "deck theme",
  "description": "A theme of deck: the look of the whole deck in a light and a dark scheme. Values are CSS values: colors, lengths, shadows, gradients and the functions rgb, hsl, oklch, color-mix, *-gradient, calc, min, max, clamp, var, blur, saturate and the like; no url() and no backslashes: the pictures of a theme (the cockpit, the page behind, a pattern) are set apart by deck.theme_image. var() takes the tokens below as --<token>, the accent of the device as --accent (--accent-0..9, --accent-light, --accent-contrast), the colors of the palette as --color-<name>-<0..9>, the radii --radius, --island-radius and --card-radius, the spacings --spacing-xs..xl, and a theme's own --theme-<name>.",
  "type": "object",
  "additionalProperties": false,
  "required": ["version", "title", "mood"],
  "properties": {
    "version": {"const": 1},
    "title": {"type": "object", "description": "The name of the theme by language; en is required.", "required": ["en"],
      "additionalProperties": {"type": "string", "minLength": 1, "maxLength": 40}},
    "mood": {"type": "string", "minLength": 1, "maxLength": 600, "description": "The style of pictures in this theme, in words, for the model that draws the covers of modules."},
    "schemes": {"type": "array", "description": "The color schemes the theme has; a theme of one scheme forces it. Both by default.", "minItems": 1, "uniqueItems": true,
      "items": {"enum": ["light", "dark"]}},
    "accent": {"type": "string", "description": "The accent a device takes when the owner picks the theme; the device may change it after."},
    "font": {"type": "object", "additionalProperties": false, "description": "Font stacks of the text and the headings; the system face without them.",
      "properties": {"text": {"type": "string", "maxLength": 200}, "headings": {"type": "string", "maxLength": 200}}},
    "radius": {"enum": ["0", "xs", "sm", "md", "lg", "xl"], "description": "The radius of controls; md by default."},
    "density": {"enum": ["compact", "default", "comfortable"], "description": "The spacing; a device scales it further."},
    "tokens": {"$ref": "#/$defs/tokens", "description": "Tokens of both schemes."},
    "light": {"$ref": "#/$defs/tokens", "description": "Tokens of the light scheme over tokens."},
    "dark": {"$ref": "#/$defs/tokens", "description": "Tokens of the dark scheme over tokens."},
    "parts": {"type": "object", "additionalProperties": false, "description": "The look of the parts of deck: card is a block of a screen, and its radius that of the cards of modules too unless tile has its own; tile a card of a module in the grid (the cockpit's card is the token cockpit and the class today); notification a notification or a toast; menu a dropdown; dialog a dialog or a sheet; tabs a tab of a screen or of the screens of a module; bubble a message of the owner in the chat; side the side panel of a screen of a module; widget the view of a module in its card; empty the words of a block with nothing; pending the lines of what loads.",
      "properties": {"button": {"$ref": "#/$defs/part"}, "card": {"$ref": "#/$defs/part"}, "island": {"$ref": "#/$defs/part"},
        "field": {"$ref": "#/$defs/part"}, "badge": {"$ref": "#/$defs/part"}, "tile": {"$ref": "#/$defs/part"},
        "notification": {"$ref": "#/$defs/part"}, "menu": {"$ref": "#/$defs/part"}, "dialog": {"$ref": "#/$defs/part"},
        "tabs": {"$ref": "#/$defs/part"}, "bubble": {"$ref": "#/$defs/part"}, "side": {"$ref": "#/$defs/part"},
        "widget": {"$ref": "#/$defs/part"}, "empty": {"$ref": "#/$defs/part"}, "pending": {"$ref": "#/$defs/part"}}},
    "css": {"type": "string", "maxLength": 20000, "description": "More CSS. A selector is made of the classes of the catalog alone (.button, .nav .asks, .tab[data-active], .h2:hover), states [data-variant=…], [data-active], [data-disabled], [data-checked], [data-expanded], [data-cover] and [data-big] of a card, :hover, :active, :focus, :focus-visible, :focus-within, :disabled, :first-child, :last-child, :not(…), ::before, ::after, ::placeholder, and the combinators space, >, +, ~. .root, .light and .dark are the page in both schemes, the light and the dark one, and only start a selector. At-rules: @media of prefers-*, forced-colors, hover, pointer, min-width, max-width; @supports. Custom properties: the tokens, the accent and the radii by their names above, and --theme-<name>."}
  },
  "$defs": {
    "tokenNames": {"enum": ["canvas", "body", "island", "block", "text", "text-2", "dimmed", "line", "divider", "hover", "fill", "fill-hover", "ring", "shadow", "pattern-size", "sky", "meadow", "cockpit", "tile", "tile-shade", "tile-text", "tile-icon", "tile-shadow", "tile-lift", "tile-min", "tile-height", "tile-gap", "toast", "toast-text", "side", "side-width", "placing"]},
    "tokens": {"type": "object", "additionalProperties": false, "propertyNames": {"$ref": "#/$defs/tokenNames"},
      "patternProperties": {"": {"type": "string", "minLength": 1, "maxLength": 400}}},
    "part": {"type": "object", "additionalProperties": false,
      "properties": {
        "radius": {"type": "string", "description": "0, xs..xl or a length"},
        "shadow": {"type": "string"}, "border": {"type": "string"}, "background": {"type": "string"},
        "transform": {"enum": ["none", "uppercase", "lowercase", "capitalize"]},
        "weight": {"type": "string"}, "spacing": {"type": "string", "description": "letter spacing"}}}
  },
  "catalog": {
    "tokens": {
      "canvas": {"var": "--deck-canvas", "desc": "The page behind the islands; a color or a gradient", "light": "color-mix(in srgb, var(--accent) 5%, #eceef3)", "dark": "color-mix(in srgb, var(--accent) 6%, #08080b)"},
      "body": {"var": "--mantine-color-body", "desc": "The background of controls, dialogs and menus", "light": "#ffffff", "dark": "var(--color-dark-7)"},
      "island": {"var": "--deck-island-bg", "desc": "The menu, the screen and the chat", "light": "var(--body)", "dark": "var(--body)"},
      "block": {"var": "--deck-block-bg", "desc": "A block of a screen", "light": "var(--body)", "dark": "var(--body)"},
      "text": {"var": "--mantine-color-text", "desc": "The text", "light": "#000000", "dark": "var(--color-dark-0)"},
      "text-2": {"var": "--deck-text-2", "desc": "Secondary text of the cockpit", "light": "color-mix(in srgb, var(--text) 82%, transparent)", "dark": "color-mix(in srgb, var(--text) 82%, transparent)"},
      "dimmed": {"var": "--mantine-color-dimmed", "desc": "Quiet text", "light": "var(--color-gray-6)", "dark": "var(--color-dark-2)"},
      "line": {"var": "--mantine-color-default-border", "desc": "Borders of controls", "light": "var(--color-gray-4)", "dark": "var(--color-dark-4)"},
      "divider": {"var": "--deck-line", "desc": "Lines between rows", "light": "var(--line)", "dark": "var(--line)"},
      "hover": {"var": "--mantine-color-default-hover", "desc": "A control under the pointer", "light": "var(--color-gray-0)", "dark": "var(--color-dark-5)"},
      "fill": {"var": "--deck-fill", "desc": "Quiet fills: icons of stats, heads of the menu", "light": "var(--hover)", "dark": "var(--hover)"},
      "fill-hover": {"var": "--deck-fill-hover", "desc": "A fill under the pointer", "light": "var(--hover)", "dark": "var(--hover)"},
      "ring": {"var": "--deck-ring", "desc": "The thin edge of islands and blocks, a box-shadow", "light": "0 0 0 1px rgb(16 24 40 / 0.04)", "dark": "0 0 0 1px rgb(255 255 255 / 0.07), inset 0 1px 0 rgb(255 255 255 / 0.04)"},
      "shadow": {"var": "--deck-shadow", "desc": "The shadow of islands and blocks", "light": "0 1px 2px rgb(16 24 40 / 0.06), 0 4px 10px -2px rgb(16 24 40 / 0.05), 0 18px 40px -14px rgb(16 24 40 / 0.22)", "dark": "0 1px 2px rgb(0 0 0 / 0.5), 0 4px 10px -2px rgb(0 0 0 / 0.35), 0 22px 48px -14px rgb(0 0 0 / 0.85)"},
      "pattern-size": {"var": "--deck-pattern-size", "desc": "The width of a tile of the pattern picture of the theme behind the page", "light": "320px", "dark": "320px"},
      "sky": {"var": "--deck-sky", "desc": "The sky of the cockpit's head", "light": "linear-gradient(170deg, #cfe6fa, #eaf4fc)", "dark": "linear-gradient(170deg, #1b2f4a, #142234)"},
      "meadow": {"var": "--deck-meadow", "desc": "The ground under the sky at the foot of the page; none for no ground", "light": "none", "dark": "none"},
      "cockpit": {"var": "--deck-cockpit", "desc": "The card of the cockpit among the cards of modules; a color or a gradient under tile-shade and tile-text", "light": "linear-gradient(135deg, var(--accent-5), var(--accent-8))", "dark": "linear-gradient(135deg, var(--accent-6), var(--accent-9))"},
      "tile": {"var": "--deck-tile", "desc": "A card of a module without a cover; empty for a color of its own by the module's name", "light": "", "dark": ""},
      "tile-shade": {"var": "--deck-tile-shade", "desc": "The shade under the text of a card, over its cover or color; a gradient whose last stop is under the text", "light": "linear-gradient(180deg, rgb(0 0 0 / 0) 35%, rgb(0 0 0 / 0.55) 100%)", "dark": "linear-gradient(180deg, rgb(0 0 0 / 0) 35%, rgb(0 0 0 / 0.55) 100%)"},
      "tile-text": {"var": "--deck-tile-text", "desc": "The text and icons of a card", "light": "#ffffff", "dark": "#ffffff"},
      "tile-icon": {"var": "--deck-tile-icon", "desc": "The plate under the icon of a card", "light": "rgb(0 0 0 / 0.28)", "dark": "rgb(0 0 0 / 0.28)"},
      "tile-shadow": {"var": "--deck-tile-shadow", "desc": "The shadow of a card, a box-shadow", "light": "0 1px 3px rgb(0 0 0 / 0.05), 0 10px 15px -5px rgb(0 0 0 / 0.05), 0 7px 7px -5px rgb(0 0 0 / 0.04)", "dark": "0 1px 3px rgb(0 0 0 / 0.4), 0 10px 15px -5px rgb(0 0 0 / 0.35), 0 7px 7px -5px rgb(0 0 0 / 0.3)"},
      "tile-lift": {"var": "--deck-tile-lift", "desc": "How a card rises under the pointer, a transform; none for staying", "light": "scale(1.015)", "dark": "scale(1.015)"},
      "tile-min": {"var": "--deck-tile-min", "desc": "The least width of a card in the grid", "light": "200px", "dark": "200px"},
      "tile-height": {"var": "--deck-tile-height", "desc": "The height of a card on a wide screen; a phone takes four fifths of it", "light": "180px", "dark": "180px"},
      "tile-gap": {"var": "--deck-tile-gap", "desc": "The space between cards; a phone takes half of it", "light": "var(--spacing-xl)", "dark": "var(--spacing-xl)"},
      "toast": {"var": "--deck-toast", "desc": "A toast, the short note with Undo after a press", "light": "#0e1116", "dark": "#2b2d33"},
      "toast-text": {"var": "--deck-toast-text", "desc": "The text of a toast", "light": "#ffffff", "dark": "#ffffff"},
      "side": {"var": "--deck-side", "desc": "The side panel of a screen of a module, beside its blocks; a color", "light": "var(--fill)", "dark": "var(--fill)"},
      "side-width": {"var": "--deck-side-width", "desc": "The width of the side panel on a computer", "light": "240px", "dark": "240px"},
      "placing": {"var": "--deck-placing", "desc": "The free cells a card moves to while the owner places the tiles", "light": "var(--accent-light)", "dark": "var(--accent-light)"}
    },
    "vars": {"accent": "--mantine-primary-color-filled", "accent-light": "--mantine-primary-color-light", "accent-contrast": "--mantine-primary-color-contrast",
      "radius": "--mantine-radius-default", "island-radius": "--deck-island-radius", "card-radius": "--deck-block-radius",
      "spacing-xs": "--mantine-spacing-xs", "spacing-sm": "--mantine-spacing-sm", "spacing-md": "--mantine-spacing-md", "spacing-lg": "--mantine-spacing-lg", "spacing-xl": "--mantine-spacing-xl"},
    "classes": {
      "island": "[data-island]", "nav": "[data-phone-tabs]", "nav-item": "[data-phone-tabs] [data-tab]", "main": "[data-main]",
      "chat": "[data-chat-panel]", "chat-phone": "[data-chat-phone]", "phone-bar": "[data-phone-tabs]", "block": "[data-block]",
      "card": "[data-card]", "tile": "[data-app-tile]", "today": "[data-app-tile][data-big]", "tile-icon": "[data-app-tile-icon]", "widget": "[data-widget]", "left-out": "[data-widget-left-out]", "placing": "[data-apps][data-placing] [data-app-tile]",
      "board-card": "[data-lane] [data-card]", "toast": "[data-toast]", "meadow": "[data-meadow]", "places": "[data-places]", "place": "[data-places] > a", "hero": "[data-hero]", "screen-head": "[data-screen-head]", "actions": "[data-actions]",
      "composer": "[data-composer]", "attached": ":is([data-attached-picture], [data-attached-file])", "message": "[data-message]", "bubble": "[data-bubble]", "chat-link": "[data-message='master'] a[href^='#/']",
      "turn": "[data-turn]", "turn-head": "[data-turn-head]", "turn-step": "[data-turn-step]", "turn-log": "[data-turn-log]",
      "suggest": "[data-suggest]", "chat-ask": "[data-chat-ask]", "question": "[data-question]", "cut": "[data-reply-cut]", "told": "[data-told]", "hearing": "[data-hearing]",
      "side": "[data-side]", "side-sheet": "[data-side-sheet]", "side-open": "[data-side-open]",
      "empty": "[data-empty]", "pending": "[data-pending]", "sheet": ".mantine-Drawer-content",
      "backdrop": "[data-backdrop]",
      "asks": "[data-asks]", "running": "[data-running]",
      "button": ".mantine-Button-root", "icon-button": ".mantine-ActionIcon-root", "field": ".mantine-Input-input:not([data-variant='unstyled'])",
      "badge": ".mantine-Badge-root", "paper": ".mantine-Paper-root", "group": ".mantine-Group-root",
      "dialog": ":is(.mantine-Modal-content, .mantine-Drawer-content)", "overlay": ":is(.mantine-Modal-overlay, .mantine-Drawer-overlay)",
      "popover": ":is(.mantine-Popover-dropdown, .mantine-Menu-dropdown, .mantine-HoverCard-dropdown, .mantine-Combobox-dropdown, .mantine-Select-dropdown, .mantine-MultiSelect-dropdown, .mantine-TagsInput-dropdown, .mantine-Autocomplete-dropdown)",
      "notification": ".mantine-Notification-root", "tabs": ".mantine-Tabs-list", "tab": ".mantine-Tabs-tab",
      "h1": "h1", "h2": "h2", "h3": "h3"
    },
    "parts": {
      "button": {"selector": ":is(.mantine-Button-root, .mantine-ActionIcon-root)"},
      "card": {"selector": "[data-block]", "radius": "--deck-block-radius"},
      "island": {"selector": "[data-island]", "radius": "--deck-island-radius"},
      "field": {"selector": ".mantine-Input-input:not([data-variant='unstyled'])"},
      "badge": {"selector": ".mantine-Badge-root"},
      "tile": {"selector": "[data-app-tile]:not([data-big])"},
      "notification": {"selector": ":is(.mantine-Notification-root, [data-toast])"},
      "menu": {"selector": ":is(.mantine-Popover-dropdown, .mantine-Menu-dropdown, .mantine-Combobox-dropdown)"},
      "dialog": {"selector": ":is(.mantine-Modal-content, .mantine-Drawer-content)"},
      "tabs": {"selector": ":is(.mantine-Tabs-tab, [data-places] > a)"},
      "bubble": {"selector": "[data-bubble]"},
      "side": {"selector": "[data-side]"},
      "widget": {"selector": "[data-widget]"},
      "empty": {"selector": "[data-empty]"},
      "pending": {"selector": "[data-pending] .mantine-Skeleton-root"}
    }
  }
}
