{
  "version": 1,
  "title": {
    "en": "Glass",
    "ru": "Стекло"
  },
  "mood": "Frosted translucent glass panes floating over a vivid blurred gradient of the accent color, soft highlights on the edges, depth and light, minimal, no text.",
  "light": {
    "canvas": "color-mix(in srgb, var(--accent) 7%, #e9ebf1)"
  },
  "dark": {
    "canvas": "color-mix(in srgb, var(--accent) 8%, #07070a)"
  },
  "css": ".root {\n  --theme-tint: 0.35;\n  --theme-blur: 18px;\n  --theme-saturate: 200%;\n  --theme-bg: rgb(255 255 255 / calc(0.5 + 0.5 * var(--theme-tint)));\n  --theme-bg-thick: rgb(255 255 255 / calc(0.62 + 0.38 * var(--theme-tint)));\n  --theme-fill: rgb(255 255 255 / 0.6);\n  --theme-sheen: linear-gradient(160deg, rgb(255 255 255 / 0.55) 0%, rgb(255 255 255 / 0.12) 38%, rgb(255 255 255 / 0) 60%);\n  --theme-highlight: rgb(255 255 255 / 0.95);\n  --theme-rim: rgb(255 255 255 / 0.5);\n  --theme-edge: rgb(0 0 0 / 0.08);\n  --theme-shadow: 0 2px 6px rgb(16 24 40 / 0.06), 0 24px 60px -18px rgb(16 24 40 / 0.32);\n  --theme-dimmed: rgb(60 60 67 / 0.82);\n}\n.dark {\n  --theme-bg: rgb(34 34 40 / calc(0.45 + 0.55 * var(--theme-tint)));\n  --theme-bg-thick: rgb(34 34 40 / calc(0.6 + 0.4 * var(--theme-tint)));\n  --theme-fill: rgb(255 255 255 / 0.08);\n  --theme-sheen: linear-gradient(160deg, rgb(255 255 255 / 0.14) 0%, rgb(255 255 255 / 0.03) 40%, rgb(255 255 255 / 0) 60%);\n  --theme-highlight: rgb(255 255 255 / 0.22);\n  --theme-rim: rgb(255 255 255 / 0.08);\n  --theme-edge: rgb(0 0 0 / 0.6);\n  --theme-shadow: 0 2px 6px rgb(0 0 0 / 0.4), 0 28px 64px -16px rgb(0 0 0 / 0.85);\n  --theme-dimmed: rgb(235 235 245 / 0.64);\n}\n.dialog, .popover, .tabs, .notification, .nav, .phone-bar {\n  --dimmed: var(--theme-dimmed);\n  background: var(--theme-sheen), var(--theme-bg);\n  -webkit-backdrop-filter: blur(var(--theme-blur)) saturate(var(--theme-saturate));\n  backdrop-filter: blur(var(--theme-blur)) saturate(var(--theme-saturate));\n  border: 0;\n  box-shadow: inset 0 1px 0 var(--theme-highlight), inset 0 0 0 1px var(--theme-rim), inset 0 -1px 0 rgb(0 0 0 / 0.06), 0 0 0 0.5px var(--theme-edge), var(--theme-shadow);\n}\n.dialog, .nav {\n  --theme-blur: 24px;\n  background: var(--theme-sheen), var(--theme-bg-thick);\n}\n.overlay { background: rgb(0 0 0 / 0.25); }\n.tabs { width: fit-content; max-width: 100%; padding: 4px; border-radius: calc(var(--radius) + 4px); }\n.tabs::before { display: none; }\n.tab { border: 0; border-radius: var(--radius); margin: 0; }\n.tab[data-active] { background: var(--accent); color: var(--accent-contrast); box-shadow: 0 4px 12px -4px color-mix(in srgb, var(--accent) 70%, transparent); }\n.screen-head .icon-button[data-variant=default], .screen-head .button[data-variant=default] {\n  background: var(--theme-fill);\n  -webkit-backdrop-filter: blur(12px) saturate(180%);\n  backdrop-filter: blur(12px) saturate(180%);\n  border-color: var(--theme-edge);\n  box-shadow: inset 0 1px 0 var(--theme-highlight), 0 6px 16px -8px rgb(0 0 0 / 0.3);\n}\n.chat-phone .dialog { background: var(--body); -webkit-backdrop-filter: none; backdrop-filter: none; }\n@supports not ((backdrop-filter: blur(1px)) or (-webkit-backdrop-filter: blur(1px))) {\n  .root { --theme-tint: 1; }\n}\n@media (prefers-reduced-transparency: reduce) {\n  .root { --theme-tint: 1; --theme-sheen: linear-gradient(transparent, transparent); }\n  .dialog, .popover, .tabs, .notification, .nav, .phone-bar { -webkit-backdrop-filter: none; backdrop-filter: none; }\n}\n@media (prefers-contrast: more) {\n  .root { --theme-tint: 1; --theme-sheen: linear-gradient(transparent, transparent); }\n  .dialog, .popover, .tabs, .notification, .nav, .phone-bar { --dimmed: var(--text); -webkit-backdrop-filter: none; backdrop-filter: none; box-shadow: 0 0 0 1px var(--text); }\n}\n@media (forced-colors: active) {\n  .dialog, .popover, .tabs, .notification, .nav, .phone-bar { -webkit-backdrop-filter: none; backdrop-filter: none; }\n}\n"
}
